{
  "$schema": "https://json-schema.org/draft/2020-12/schema",
  "$id": "https://example.local/schemas/proverb-categories.schema.json",
  "title": "Proverb Categories Challenge Pack",
  "type": "object",
  "additionalProperties": false,
  "required": [
    "$schema",
    "game",
    "version",
    "displayName",
    "roundsPerSession",
    "sessions"
  ],
  "properties": {
    "$schema": {
      "type": "string"
    },
    "game": {
      "const": "proverb-categories"
    },
    "version": {
      "type": "integer",
      "minimum": 1
    },
    "displayName": {
      "type": "string",
      "minLength": 1
    },
    "roundsPerSession": {
      "type": "integer",
      "minimum": 1
    },
    "sessions": {
      "type": "array",
      "minItems": 1,
      "items": {
        "$ref": "#/$defs/session"
      }
    }
  },
  "$defs": {
    "session": {
      "type": "object",
      "additionalProperties": false,
      "required": [
        "id",
        "title",
        "theme",
        "rounds"
      ],
      "properties": {
        "id": {
          "type": "string",
          "pattern": "^[a-z0-9-]+$"
        },
        "title": {
          "type": "string",
          "minLength": 1
        },
        "theme": {
          "type": "string",
          "minLength": 1
        },
        "rounds": {
          "type": "array",
          "minItems": 1,
          "items": {
            "$ref": "#/$defs/round"
          }
        }
      }
    },
    "round": {
      "type": "object",
      "additionalProperties": false,
      "required": [
        "id",
        "title",
        "theme",
        "categories",
        "cards",
        "difficulty",
        "teachingNote"
      ],
      "properties": {
        "id": {
          "type": "string",
          "minLength": 1
        },
        "title": {
          "type": "string",
          "minLength": 1
        },
        "theme": {
          "type": "string",
          "minLength": 1
        },
        "categories": {
          "type": "array",
          "minItems": 5,
          "maxItems": 5,
          "uniqueItems": true,
          "items": {
            "type": "string",
            "minLength": 1
          }
        },
        "cards": {
          "type": "array",
          "minItems": 15,
          "maxItems": 25,
          "items": {
            "type": "object",
            "additionalProperties": false,
            "required": [
              "cardId",
              "reference",
              "textShort",
              "category",
              "difficulty",
              "teachingNote"
            ],
            "properties": {
              "cardId": {
                "type": "string",
                "pattern": "^[a-z0-9-]+$"
              },
              "reference": {
                "type": "string",
                "minLength": 1
              },
              "textShort": {
                "type": "string",
                "minLength": 1
              },
              "category": {
                "type": "string",
                "minLength": 1
              },
              "difficulty": {
                "enum": [
                  "easy",
                  "medium",
                  "hard"
                ]
              },
              "teachingNote": {
                "type": "string",
                "minLength": 1
              }
            }
          }
        },
        "difficulty": {
          "type": "string",
          "enum": [
            "easy",
            "medium",
            "hard"
          ]
        },
        "teachingNote": {
          "type": "string",
          "minLength": 1
        }
      }
    }
  }
}
