{
  "$schema": "./schemas/proverb-categories.schema.json",
  "game": "proverb-categories",
  "version": 1,
  "displayName": "Proverb Categories Challenge",
  "roundsPerSession": 1,
  "sessions": [
    {
      "id": "pcv-session-01",
      "title": "Proverb Category Boards",
      "theme": "Sort Proverbs cards into wisdom categories.",
      "rounds": [
        {
          "id": "pcv-001",
          "title": "Proverb Category Board 01",
          "theme": "Sorting Proverbs by wisdom category",
          "categories": [
            "Fear of the Lord",
            "Pride and Humility",
            "Correction and Discipline",
            "Parents and Children",
            "Peace and Conflict"
          ],
          "cards": [
            {
              "cardId": "pcv-s01-c01",
              "reference": "Proverbs 1:7",
              "textShort": "The fear of the Lord is the beginning of knowledge.",
              "category": "Fear of the Lord",
              "difficulty": "easy",
              "teachingNote": "This proverb belongs with fear of the lord because its wording centers on that wisdom theme."
            },
            {
              "cardId": "pcv-s01-c02",
              "reference": "Proverbs 9:10",
              "textShort": "The fear of the Lord is the beginning of wisdom.",
              "category": "Fear of the Lord",
              "difficulty": "easy",
              "teachingNote": "This proverb belongs with fear of the lord because its wording centers on that wisdom theme."
            },
            {
              "cardId": "pcv-s01-c03",
              "reference": "Proverbs 14:27",
              "textShort": "The fear of the Lord is a fountain of life.",
              "category": "Fear of the Lord",
              "difficulty": "easy",
              "teachingNote": "This proverb belongs with fear of the lord because its wording centers on that wisdom theme."
            },
            {
              "cardId": "pcv-s01-c04",
              "reference": "Proverbs 16:18",
              "textShort": "Pride goeth before destruction.",
              "category": "Pride and Humility",
              "difficulty": "easy",
              "teachingNote": "This proverb belongs with pride and humility because its wording centers on that wisdom theme."
            },
            {
              "cardId": "pcv-s01-c05",
              "reference": "Proverbs 18:12",
              "textShort": "Before honour is humility.",
              "category": "Pride and Humility",
              "difficulty": "easy",
              "teachingNote": "This proverb belongs with pride and humility because its wording centers on that wisdom theme."
            },
            {
              "cardId": "pcv-s01-c06",
              "reference": "Proverbs 22:4",
              "textShort": "By humility and the fear of the Lord are riches.",
              "category": "Pride and Humility",
              "difficulty": "easy",
              "teachingNote": "This proverb belongs with pride and humility because its wording centers on that wisdom theme."
            },
            {
              "cardId": "pcv-s01-c07",
              "reference": "Proverbs 12:1",
              "textShort": "Whoso loveth instruction loveth knowledge.",
              "category": "Correction and Discipline",
              "difficulty": "easy",
              "teachingNote": "This proverb belongs with correction and discipline because its wording centers on that wisdom theme."
            },
            {
              "cardId": "pcv-s01-c08",
              "reference": "Proverbs 13:24",
              "textShort": "He that loveth him chasteneth him betimes.",
              "category": "Correction and Discipline",
              "difficulty": "easy",
              "teachingNote": "This proverb belongs with correction and discipline because its wording centers on that wisdom theme."
            },
            {
              "cardId": "pcv-s01-c09",
              "reference": "Proverbs 19:18",
              "textShort": "Chasten thy son while there is hope.",
              "category": "Correction and Discipline",
              "difficulty": "easy",
              "teachingNote": "This proverb belongs with correction and discipline because its wording centers on that wisdom theme."
            },
            {
              "cardId": "pcv-s01-c10",
              "reference": "Proverbs 1:8",
              "textShort": "My son, hear the instruction of thy father.",
              "category": "Parents and Children",
              "difficulty": "medium",
              "teachingNote": "This proverb belongs with parents and children because its wording centers on that wisdom theme."
            },
            {
              "cardId": "pcv-s01-c11",
              "reference": "Proverbs 22:6",
              "textShort": "Train up a child in the way he should go.",
              "category": "Parents and Children",
              "difficulty": "medium",
              "teachingNote": "This proverb belongs with parents and children because its wording centers on that wisdom theme."
            },
            {
              "cardId": "pcv-s01-c12",
              "reference": "Proverbs 31:10",
              "textShort": "Who can find a virtuous woman?",
              "category": "Parents and Children",
              "difficulty": "medium",
              "teachingNote": "This proverb belongs with parents and children because its wording centers on that wisdom theme."
            },
            {
              "cardId": "pcv-s01-c13",
              "reference": "Proverbs 10:12",
              "textShort": "Hatred stirreth up strifes.",
              "category": "Peace and Conflict",
              "difficulty": "medium",
              "teachingNote": "This proverb belongs with peace and conflict because its wording centers on that wisdom theme."
            },
            {
              "cardId": "pcv-s01-c14",
              "reference": "Proverbs 15:18",
              "textShort": "A wrathful man stirreth up strife.",
              "category": "Peace and Conflict",
              "difficulty": "medium",
              "teachingNote": "This proverb belongs with peace and conflict because its wording centers on that wisdom theme."
            },
            {
              "cardId": "pcv-s01-c15",
              "reference": "Proverbs 17:14",
              "textShort": "The beginning of strife is as when one letteth out water.",
              "category": "Peace and Conflict",
              "difficulty": "medium",
              "teachingNote": "This proverb belongs with peace and conflict because its wording centers on that wisdom theme."
            }
          ],
          "difficulty": "easy",
          "teachingNote": "Review Proverb Category Board 01 and how it connects to the Bible before continuing."
        },
        {
          "id": "pcv-002",
          "title": "Proverb Category Board 02",
          "theme": "Sorting Proverbs by wisdom category",
          "categories": [
            "Wise Speech",
            "Diligence and Laziness",
            "Money and Generosity",
            "Wisdom and Understanding",
            "Foolishness"
          ],
          "cards": [
            {
              "cardId": "pcv-s02-c01",
              "reference": "Proverbs 10:19",
              "textShort": "He that refraineth his lips is wise.",
              "category": "Wise Speech",
              "difficulty": "easy",
              "teachingNote": "This proverb belongs with wise speech because its wording centers on that wisdom theme."
            },
            {
              "cardId": "pcv-s02-c02",
              "reference": "Proverbs 15:1",
              "textShort": "A soft answer turneth away wrath.",
              "category": "Wise Speech",
              "difficulty": "easy",
              "teachingNote": "This proverb belongs with wise speech because its wording centers on that wisdom theme."
            },
            {
              "cardId": "pcv-s02-c03",
              "reference": "Proverbs 16:24",
              "textShort": "Pleasant words are as an honeycomb.",
              "category": "Wise Speech",
              "difficulty": "easy",
              "teachingNote": "This proverb belongs with wise speech because its wording centers on that wisdom theme."
            },
            {
              "cardId": "pcv-s02-c04",
              "reference": "Proverbs 6:6",
              "textShort": "Go to the ant, thou sluggard.",
              "category": "Diligence and Laziness",
              "difficulty": "easy",
              "teachingNote": "This proverb belongs with diligence and laziness because its wording centers on that wisdom theme."
            },
            {
              "cardId": "pcv-s02-c05",
              "reference": "Proverbs 10:4",
              "textShort": "The hand of the diligent maketh rich.",
              "category": "Diligence and Laziness",
              "difficulty": "easy",
              "teachingNote": "This proverb belongs with diligence and laziness because its wording centers on that wisdom theme."
            },
            {
              "cardId": "pcv-s02-c06",
              "reference": "Proverbs 13:4",
              "textShort": "The soul of the diligent shall be made fat.",
              "category": "Diligence and Laziness",
              "difficulty": "easy",
              "teachingNote": "This proverb belongs with diligence and laziness because its wording centers on that wisdom theme."
            },
            {
              "cardId": "pcv-s02-c07",
              "reference": "Proverbs 11:25",
              "textShort": "The liberal soul shall be made fat.",
              "category": "Money and Generosity",
              "difficulty": "easy",
              "teachingNote": "This proverb belongs with money and generosity because its wording centers on that wisdom theme."
            },
            {